SciVis,2005,The magic volume lens: an interactive focus+context technique for volume rendering,10.1109/VISUAL.2005.1532818,http://dx.doi.org/10.1109/VISUAL.2005.1532818,367,374,1532818,,C,The size and resolution of volume datasets in science and medicine are increasing at a rate much greater than the resolution of the screens used to view them. This limits the amount of data that can be viewed simultaneously,,,,,
SciVis,2005,The software interface to the 3D-force microscope,10.1109/VISUAL.2005.1532829,http://dx.doi.org/10.1109/VISUAL.2005.1532829,455,462,1532829,,C,We have developed a real-time experiment-control and data-display system for a novel microscope,,,,,
SciVis,2005,The value of visualization,10.1109/VISUAL.2005.1532781,http://dx.doi.org/10.1109/VISUAL.2005.1532781,79,86,1532781,,C,The field of visualization is getting mature. Many problems have been solved,,,,,
SciVis,2005,The visible radio: process visualization of a software-defined radio,10.1109/VISUAL.2005.1532791,http://dx.doi.org/10.1109/VISUAL.2005.1532791,159,165,1532791,,C,In this case study,,,,,
SciVis,2005,Topological structures of 3D tensor fields,10.1109/VISUAL.2005.1532841,http://dx.doi.org/10.1109/VISUAL.2005.1532841,551,558,1532841,,C,Tensor topology is useful in providing a simplified and yet detailed representation of a tensor field. Recently the field of 3D tensor topology is advanced by the discovery that degenerate tensors usually form lines in their most basic configurations. These lines form the backbone for further topological analysis. A number of ways for extracting and tracing the degenerate tensor lines have also been proposed. In this paper,,,,,
SciVis,2005,Topology-based simplification for feature extraction from 3D scalar fields,10.1109/VISUAL.2005.1532839,http://dx.doi.org/10.1109/VISUAL.2005.1532839,535,542,1532839,,C,In this paper,,,,,
SciVis,2005,Topology-driven surface mappings with robust feature alignment,10.1109/VISUAL.2005.1532840,http://dx.doi.org/10.1109/VISUAL.2005.1532840,543,550,1532840,,C,Topological concepts and techniques have been broadly applied in computer graphics and geometric modeling. However,,,,,
SciVis,2005,Understanding visualization through spatial ability differences,10.1109/VISUAL.2005.1532836,http://dx.doi.org/10.1109/VISUAL.2005.1532836,511,518,1532836,,C,Little is known about the cognitive abilities which influence the comprehension of scientific and information visualizations and what properties of the visualization affect comprehension. Our goal in this paper is to understand what makes visualizations difficult. We address this goal by examining the spatial ability differences in a diverse population selected for spatial ability variance. For example,,,,,
SciVis,2005,View selection for volume rendering,10.1109/VISUAL.2005.1532833,http://dx.doi.org/10.1109/VISUAL.2005.1532833,487,494,1532833,,C,In a visualization of a three-dimensional dataset,,,,,
SciVis,2005,View-dependent rendering of multiresolution texture-atlases,10.1109/VISUAL.2005.1532798,http://dx.doi.org/10.1109/VISUAL.2005.1532798,215,222,1532798,,C,Real-time rendering of massively textured 3D scenes usually involves two major problems: Large numbers of texture switches are a well-known performance bottleneck and the set of simultaneously visible textures is limited by the graphics memory. This paper presents a level-of-detail texturing technique that overcomes both problems. In a preprocessing step,,,,,
SciVis,2005,VisTrails: enabling interactive multiple-view visualizations,10.1109/VISUAL.2005.1532788,http://dx.doi.org/10.1109/VISUAL.2005.1532788,135,142,1532788,,C,VisTrails is a new system that enables interactive multiple-view visualizations by simplifying the creation and maintenance of visualization pipelines,,,,,
SciVis,2005,Visual analysis and exploration of fluid flow in a cooling jacket,10.1109/VISUAL.2005.1532850,http://dx.doi.org/10.1109/VISUAL.2005.1532850,623,630,1532850,,C,We present a visual analysis and exploration of fluid flow through a cooling jacket. Engineers invest a large amount of time and serious effort to optimize the flow through this engine component because of its important role in transferring heat away from the engine block. In this study we examine the design goals that engineers apply in order to construct an ideal-as-possible cooling jacket geometry and use a broad range of visualization tools in order to analyze,,,,,
SciVis,2005,Visualization in the Einstein Year 2005: a case study on explanatory and illustrative visualization of relativity and astrophysics,10.1109/VISUAL.2005.1532845,http://dx.doi.org/10.1109/VISUAL.2005.1532845,583,590,1532845,,C,In this application paper,,,,,
SciVis,2005,Visualization of the genus of knots,10.1109/VISUAL.2005.1532843,http://dx.doi.org/10.1109/VISUAL.2005.1532843,567,574,1532843,,C,The genus of a knot or link can be defined via Seifert surfaces. A Seifert surface of a knot or link is an oriented surface whose boundary coincides with that,,,,,
SciVis,2005,Visualization of time-dependent remote adaptive mesh refinement data,10.1109/VISUAL.2005.1532793,http://dx.doi.org/10.1109/VISUAL.2005.1532793,175,182,1532793,,C,Analysis of phenomena that simultaneously occur on different spatial and temporal scales requires adaptive,,,,,
SciVis,2005,Visualization of white matter tracts with wrapped streamlines,10.1109/VISUAL.2005.1532777,http://dx.doi.org/10.1109/VISUAL.2005.1532777,51,58,1532777,,C,Diffusion tensor imaging is a magnetic resonance imaging method which has gained increasing importance in neuroscience and especially in neurosurgery. It acquires diffusion properties represented by a symmetric 2nd order tensor for each voxel in the gathered dataset. From the medical point of view,,,,,
SciVis,2005,Visualization with stylized line primitives,10.1109/VISUAL.2005.1532859,http://dx.doi.org/10.1109/VISUAL.2005.1532859,695,702,1532859,,C,Line primitives are a very powerful visual attribute used for scientific visualization and in particular for 3D vector-field visualization. We extend the basic line primitives with additional visual attributes including color,,,,,
SciVis,2005,Visualizing data with motion,10.1109/VISUAL.2005.1532838,http://dx.doi.org/10.1109/VISUAL.2005.1532838,527,534,1532838,,C,This paper describes an experimental study of three perceptual properties of motion: flicker,,,,,
SciVis,2005,Visualizing intersecting surfaces with nested-surface techniques,10.1109/VISUAL.2005.1532835,http://dx.doi.org/10.1109/VISUAL.2005.1532835,503,510,1532835,,C,This paper describes the adaptation and evaluation of existing nested-surface visualization techniques for the problem of displaying intersecting surfaces. For this work,,,,,
SciVis,2005,Visualizing tensor fields in geomechanics,10.1109/VISUAL.2005.1532774,http://dx.doi.org/10.1109/VISUAL.2005.1532774,35,42,1532774,,C,The study of stress and strains in soils and structures (solids) help us gain a better understanding of events such as failure of bridges,,,,,
SciVis,2005,Visualizing the tightening of knots,10.1109/VISUAL.2005.1532844,http://dx.doi.org/10.1109/VISUAL.2005.1532844,575,582,1532844,,C,The study of physical models for knots has recently received much interest in the mathematics community. In this paper,,,,,
SciVis,2005,VolQD: direct volume rendering of multi-million atom quantum dot simulations,10.1109/VISUAL.2005.1532811,http://dx.doi.org/10.1109/VISUAL.2005.1532811,319,326,1532811,,C,In this work we present a hardware-accelerated direct volume rendering system for visualizing multivariate wave functions in semiconducting quantum dot (QD) simulations. The simulation data contains the probability density values of multiple electron orbitals for up to tens of millions of atoms,,,,,
SciVis,2005,Volume rendering of smoke propagation CFD data,10.1109/VISUAL.2005.1532813,http://dx.doi.org/10.1109/VISUAL.2005.1532813,335,341,1532813,,C,The evacuation of buildings in the event of a fire requires careful planning of ventilation and evacuation routes during early architectural design stages. Different designs are evaluated by simulating smoke propagation using computational fluid dynamics (CFD). Visibility plays a decisive role in finding the nearest fire exit. This paper presents real-time volume rendering of transient smoke propagation conforming to standardized visibility distances. We visualize time dependent smoke particle concentration on unstructured tetrahedral meshes using a direct volume rendering approach. Due to the linear transfer function of the optical model commonly used in fire protection engineering,,,,,
SciVis,2005,VolumeExplorer: roaming large volumes to couple visualization and data processing for oil and gas exploration,10.1109/VISUAL.2005.1532802,http://dx.doi.org/10.1109/VISUAL.2005.1532802,247,254,1532802,,C,In this paper,,,,,
SciVis,2005,VolumeShop: an interactive system for direct volume illustration,10.1109/VISUAL.2005.1532856,http://dx.doi.org/10.1109/VISUAL.2005.1532856,671,678,1532856,,C,Illustrations play a major role in the education process. Whether used to teach a surgical or radiologic procedure,,,,,
SciVis,2004,2D Maps for Visual Analysis and Retrieval in Large Multi-Feature 3D Model Databases,10.1109/VISUAL.2004.2,http://dx.doi.org/10.1109/VISUAL.2004.2,2,2,1372251,X,M,Multimedia objects are often described by high-dimensional feature vectors which can be used for retrieval and clustering tasks. We have built an interactive retrieval system for 3D model databases that implements a variety of different feature transforms. Recently,,,,,
SciVis,2004,800Exploration of the brain's white matter pathways with dynamic queries,10.1109/VISUAL.2004.30,http://dx.doi.org/10.1109/VISUAL.2004.30,377,384,1372220,,C,Diffusion tensor imaging (DTI) is a magnetic resonance imaging method that can be used to measure local information about the structure of white matter within the human brain. Combining DTI data with the computational methods of MR tractography,,,,,
InfoVis,2004,A Comparison of the Readability of Graphs Using Node-Link and Matrix-Based Representations,10.1109/INFVIS.2004.1,http://dx.doi.org/10.1109/INFVIS.2004.1,17,24,1382886,,C,In this paper,,,,,
SciVis,2004,A graphics hardware-based vortex detection and visualization system,10.1109/VISUAL.2004.3,http://dx.doi.org/10.1109/VISUAL.2004.3,195,202,1372197,,C,Feature detection in flow fields is a well-researched area,,,,,
InfoVis,2004,A History Mechanism for Visual Data Mining,10.1109/INFVIS.2004.2,http://dx.doi.org/10.1109/INFVIS.2004.2,49,56,1382890,,C,A major challenge of current visualization and visual data mining (VDM) frameworks is to support users in the orientation in complex visual mining scenarios. An important aspect to increase user support and user orientation is to use a history mechanism that,,,,,
InfoVis,2004,A Rank-by-Feature Framework for Unsupervised Multidimensional Data Exploration Using Low Dimensional Projections,10.1109/INFVIS.2004.3,http://dx.doi.org/10.1109/INFVIS.2004.3,65,72,1382892,,C,Exploratory analysis of multidimensional data sets is challenging because of the difficulty in comprehending more than three dimensions. Two fundamental statistical principles for the exploratory analysis are (1) to examine each dimension first and then find relationships among dimensions,,,,,
SciVis,2004,Adaptive 4-8 texture hierarchies,10.1109/VISUAL.2004.4,http://dx.doi.org/10.1109/VISUAL.2004.4,219,226,1372200,,C,We address the texture level-of-detail problem for extremely large surfaces such as terrain during realtime,,,,,
InfoVis,2004,An Associative Information Visualizer,10.1109/INFVIS.2004.4,http://dx.doi.org/10.1109/INFVIS.2004.4,r8,r8,1382941,X,M,,White,,,,
InfoVis,2004,An Evaluation of Microarray Visualization Tools for Biological Insight,10.1109/INFVIS.2004.5,http://dx.doi.org/10.1109/INFVIS.2004.5,1,8,1382884,,C,High-throughput experiments such as gene expression microarrays in the life sciences result in large datasets. In response,,,,,
InfoVis,2004,An Experimental Investigation of Magnification Lens Offset and Its Impact on Imagery Analysis,10.1109/INFVIS.2004.6,http://dx.doi.org/10.1109/INFVIS.2004.6,5,5,1382916,X,M,A digital lens is a user interface mechanism that is a potential solution to information mangement problems. We investigated the use of digital lensing applied to imagery analysis. Participants completed three different types of tasks (locate,,,,,
SciVis,2004,Anisotropic volume rendering for extremely dense,,,,,,,,,,,,,
InfoVis,2004,ARNA: Interactive Comparison and Alignment of RNA Secondary Structure,10.1109/INFVIS.2004.7,http://dx.doi.org/10.1109/INFVIS.2004.7,8,8,1382919,X,M,ARNA is an interactive visualization system that supports comparison and alignment of RNA secondary structure. We present a new approach to RNA alignment that exploits the complex structure of the Smith-Waterman local distance matrix,,,,,
InfoVis,2004,Artifacts of the Presence Era: Using Information Visualization to Create an Evocative Souvenir,10.1109/INFVIS.2004.8,http://dx.doi.org/10.1109/INFVIS.2004.8,105,111,1382897,,C,We present Artifacts of the Presence Era,,,,,
SciVis,2004,Atlas-Aware Laplacian Smoothing,10.1109/VISUAL.2004.6,http://dx.doi.org/10.1109/VISUAL.2004.6,27,27,1372276,X,M,,Sibley,,,,
SciVis,2004,Augmented reality with tangible auto-fabricated models for molecular biology applications,10.1109/VISUAL.2004.7,http://dx.doi.org/10.1109/VISUAL.2004.7,235,241,1372202,,C,"The evolving technology of computer auto-fabrication (""3D printing"") now makes it possible to produce physical models for complex biological molecules and assemblies. We report on an application that demonstrates the use of auto-fabricated tangible models and augmented reality for research and education in molecular biology",,,,,
SciVis,2004,Automatic Fast Detection of Tumor Suspect Areas on CT Scan,10.1109/VISUAL.2004.9,http://dx.doi.org/10.1109/VISUAL.2004.9,33,33,1372282,X,M,,Mancas,,,,
InfoVis,2004,A Knowledge Task-Based Framework for Design and Evaluation of Information Visualizations,10.1109/INFVIS.2004.10,http://dx.doi.org/10.1109/INFVIS.2004.10,143,150,1382902,,C,"The design and evaluation of most current information visualization systems descend from an emphasis on a user's ability to ""unpack"" the representations of data of interest and operate on them independently. Too often",,,,,
InfoVis,2004,BinX: Dynamic Exploration of Time Series Datasets Across Aggregation Levels,10.1109/INFVIS.2004.11,http://dx.doi.org/10.1109/INFVIS.2004.11,2,2,1382913,X,M,Many fields of study produce time series datasets,,,,,
SciVis,2004,Building an Ontology of Visualization,10.1109/VISUAL.2004.10,http://dx.doi.org/10.1109/VISUAL.2004.10,7,7,1372256,X,M,Recent activity within the UK National e-Science Programme has identified a need to establish an ontology for visualization. Motivation for this includes defining web and grid services for visualization (the ??emantic grid??,,,,,
InfoVis,2004,Building Highly-Coordinated Visualizations in Improvise,10.1109/INFVIS.2004.12,http://dx.doi.org/10.1109/INFVIS.2004.12,159,166,1382904,,C,Improvise is a fully-implemented system in which users build and browse multiview visualizations interactively using a simple shared-object coordination mechanism coupled with a flexible,,,,,
SciVis,2004,Capillary Histology Imagery Visualization and Exploration,10.1109/VISUAL.2004.11,http://dx.doi.org/10.1109/VISUAL.2004.11,30,30,1372279,X,M,,Gleicher,,,,
InfoVis,2004,Capstone Address: Visualization as a Medium for Capturing and Sharing Thoughts,10.1109/INFVIS.2004.13,http://dx.doi.org/10.1109/INFVIS.2004.13,xiii,xiii,1382883,X,M,,Roth,,,,
InfoVis,2004,Case Study: Visualizing Visualization,10.1109/INFVIS.2004.14,http://dx.doi.org/10.1109/INFVIS.2004.14,r5,r5,1382938,X,M,In this case study we attempt to visualize a real-world dataset consisting of 600 recently published information visualization papers and their references. This is done by first creating a global layout of the entire graph that preserves any cluster structure present. We then use this layout as a basis to define a hierarchical clustering. The clusters in this hierarchy are labelled using keywords supplied with the dataset,,,,,
SciVis,2004,Centroidal Voronoi tessellation based algorithms for vector fields visualization and segmentation,10.1109/VISUAL.2004.13,http://dx.doi.org/10.1109/VISUAL.2004.13,43,50,1372178,,C,A new method for the simplification and the visualization of vector fields is presented based on the notion of centroidal Voronoi tessellations (CVT's). A CVT is a special Voronoi tessellation for which the generators of the Voronoi regions in the tessellation are also the centers of mass (or means) with respect to a prescribed density. A distance function in both the spatial and vector spaces is introduced to measure the similarity of the spatially distributed vector fields. Based on such a distance,,,,,
InfoVis,2004,Clutter Reduction in Multi-Dimensional Data Visualization Using Dimension Reordering,10.1109/INFVIS.2004.15,http://dx.doi.org/10.1109/INFVIS.2004.15,89,96,1382895,,C,Visual clutter denotes a disordered collection of graphical entities in information visualization. Clutter can obscure the structure present in the data. Even in a small dataset,,,,,
SciVis,2004,Code Checking and Visualization of an Architecture Design,10.1109/VISUAL.2004.14,http://dx.doi.org/10.1109/VISUAL.2004.14,10,10,1372259,X,M,Computer graphics has be successfully applied to architecture design. There is more demand to new applications. One of them,,,,,
SciVis,2004,Compatible triangulations of spatial decompositions,10.1109/VISUAL.2004.15,http://dx.doi.org/10.1109/VISUAL.2004.15,211,217,1372199,,C,We describe a general algorithm to produce compatible 3D triangulations from spatial decompositions. Such triangulations match edges and faces across spatial cell boundaries,,,,,
SciVis,2004,Compression,,,,,,,,,,,,,
SciVis,2004,Constrained inverse volume rendering for planetary nebulae,10.1109/VISUAL.2004.18,http://dx.doi.org/10.1109/VISUAL.2004.18,83,90,1372183,,C,Determining the three-dimensional structure of distant astronomical objects is a challenging task,,,,,
SciVis,2004,Context-Adaptive Mobile Visualization and Information Management,10.1109/VISUAL.2004.19,http://dx.doi.org/10.1109/VISUAL.2004.19,8,8,1372257,X,M,This poster abstract presents a scalable information visualization system for mobile devices and desktop systems. It is designed to support the operation and the workflow of wastewater systems. The regarded information data includes general information about buildings and units,,,,,
InfoVis,2004,"Creating and Managing ""Lookmarks"" in ParaView",10.1109/INFVIS.2004.16,http://dx.doi.org/10.1109/INFVIS.2004.16,19,19,1382930,X,M,This paper describes the integration of lookmarks into the ParaView visualization tool. Lookmarks are pointers to views of specific parts of a dataset. They were so named because lookmarks are to a visualization tool and dataset as bookmarks are to a browser and the World Wide Web. A lookmark can be saved and organized among other lookmarks within the context of ParaView. Then at a later time,,,,,
SciVis,2004,DaMI - Data Management for Multimedial Information Systems,10.1109/VISUAL.2004.21,http://dx.doi.org/10.1109/VISUAL.2004.21,9,9,1372258,X,M,This paper describes a Data Management System for Multimedial Information Visualization called DaMI. It is possible to create 2D or 3D model based on data out of standard databases and additional metainformation. DaMI is a generic system guaranteeing an optimal reusability and compatibility.,Hagen,,,,
SciVis,2004,Depth Enhanced Panoramas,10.1109/VISUAL.2004.22,http://dx.doi.org/10.1109/VISUAL.2004.22,11,11,1372260,X,M,,Bahmutov,,,,
SciVis,2004,Detection and visualization of anomalous structures in molecular dynamics simulation data,10.1109/VISUAL.2004.23,http://dx.doi.org/10.1109/VISUAL.2004.23,465,472,1372231,,C,We explore techniques to detect and visualize features in data from molecular dynamics (MD) simulations. Although the techniques proposed are general,,,,,
SciVis,2004,Dispersion simulation and visualization for urban security,10.1109/VISUAL.2004.24,http://dx.doi.org/10.1109/VISUAL.2004.24,553,560,1372242,,C,We present a system for simulating and visualizing the propagation of dispersive contaminants with an application to urban security. In particular,,,,,
SciVis,2004,Display of vector fields using a reaction-diffusion model,10.1109/VISUAL.2004.25,http://dx.doi.org/10.1109/VISUAL.2004.25,115,122,1372187,,C,Effective visualization of vector fields relies on the ability to control the size and density of the underlying mapping to visual cues used to represent the field. In this paper we introduce the use of a reaction-diffusion model,,,,,
InfoVis,2004,Distortion-Based Visualization for Long-Term Continuous Acoustic Monitoring,10.1109/INFVIS.2004.17,http://dx.doi.org/10.1109/INFVIS.2004.17,21,21,1382932,X,M,Visualizing long-term acoustic data has been an important subject in the field of equipment surveillance and equipment diagnosis. This paper proposes a distortion-based visualization method of long-term acoustic data. We applied the method to 1 hour observation data of electric discharge sound,,,,,
SciVis,2004,DTI Fiber Clustering in the Whole Brain,10.1109/VISUAL.2004.26,http://dx.doi.org/10.1109/VISUAL.2004.26,28,28,1372277,X,M,,Song Zhang;Laidlaw,,,,
SciVis,2004,Dual contouring with topology-preserving simplification using enhanced cell representation,10.1109/VISUAL.2004.27,http://dx.doi.org/10.1109/VISUAL.2004.27,505,512,1372236,,C,We present a fast,,,,,
SciVis,2004,Dual marching cubes,10.1109/VISUAL.2004.28,http://dx.doi.org/10.1109/VISUAL.2004.28,489,496,1372234,,C,We present the definition and computational algorithms for a new class of surfaces which are dual to the isosurface produced by the widely used marching cubes (MC) algorithm. These new isosurfaces have the same separating properties as the MC surfaces but they are comprised of quad patches that tend to eliminate the common negative aspect of poorly shaped triangles of the MC isosurfaces. Based upon the concept of this new dual operator,,,,,
InfoVis,2004,Dynamic Drawing of Clustered Graphs,10.1109/INFVIS.2004.18,http://dx.doi.org/10.1109/INFVIS.2004.18,191,198,1382908,,C,This paper presents an algorithm for drawing a sequence of graphs that contain an inherent grouping of their vertex set into clusters. It differs from previous work on dynamic graph drawing in the emphasis that is put on maintaining the clustered structure of the graph during incremental layout. The algorithm works online and allows arbitrary modifications to the graph. It is generic and can be implemented using a wide range of static force-directed graph layout tools. The paper introduces several metrics for measuring layout quality of dynamic clustered graphs. The performance of our algorithm is analyzed using these metrics. The algorithm has been successfully applied to visualizing mobile object software,Frishman,,,,
SciVis,2004,Efficient point-based isosurface exploration using the span-triangle,10.1109/VISUAL.2004.29,http://dx.doi.org/10.1109/VISUAL.2004.29,441,448,1372228,,C,We introduce a novel span-triangle data structure,,,,,
InfoVis,2004,Evaluating a System for Interactive Exploration of Large,,,,,,,,,,,,,
InfoVis,2004,EventScope: Bringing Remote Experience of Mars to the Public through Telepresence,10.1109/INFVIS.2004.20,http://dx.doi.org/10.1109/INFVIS.2004.20,16,16,1382927,X,M,Telepresence,,,,,
InfoVis,2004,Expand-Ahead: A Space-Filling Strategy for Browsing Trees,10.1109/INFVIS.2004.21,http://dx.doi.org/10.1109/INFVIS.2004.21,119,126,1382899,,C,Many tree browsers allow subtrees under a node to be collapsed or expanded,,,,,
InfoVis,2004,Exploring and Visualizing the History of InfoVis,10.1109/INFVIS.2004.22,http://dx.doi.org/10.1109/INFVIS.2004.22,r6,r6,1382939,X,M,,Keim,,,,
InfoVis,2004,Exploring InfoVis Publication History with Tulip,10.1109/INFVIS.2004.23,http://dx.doi.org/10.1109/INFVIS.2004.23,r10,r10,1382943,X,M,We show the structure of the InfoVis publications dataset using Tulip,,,,,
InfoVis,2004,EZEL: a Visual Tool for Performance Assessment of Peer-to-Peer File-Sharing Network,10.1109/INFVIS.2004.25,http://dx.doi.org/10.1109/INFVIS.2004.25,41,48,1382889,,C,In this paper we present EZEL,,,,,
InfoVis,2004,faMailiar & Intimacy-Based Email Visualization,10.1109/INFVIS.2004.26,http://dx.doi.org/10.1109/INFVIS.2004.26,14,14,1382925,X,M,Email has developed into one of the most extensively used computer applications. Email interfaces,,,,,
SciVis,2004,Fast Rendering of Foveated Volume in the Wavelet Domain,10.1109/VISUAL.2004.31,http://dx.doi.org/10.1109/VISUAL.2004.31,26,26,1372275,X,M,,Hang Yu;Chang,,,,
SciVis,2004,Flow field clustering via algebraic multigrid,10.1109/VISUAL.2004.32,http://dx.doi.org/10.1109/VISUAL.2004.32,35,42,1372177,,C,We present a novel multiscale approach for flow visualization. We define a local alignment tensor that encodes a measure for alignment to the direction of a given flow field. This tensor induces an anisotropic differential operator on the flow domain,,,,,
SciVis,2004,Force-Feedback-Enhanced Navigation for Interactive Visualization of Coronary Vessels,10.1109/VISUAL.2004.33,http://dx.doi.org/10.1109/VISUAL.2004.33,32,32,1372281,X,M,Coronary heart disease (CHD) is the number one killer in the United States. Although it is well known that CHD mainly occurs due to blocked arteries,,,,,
SciVis,2004,Generating realistic images from hydrothermal plume data,10.1109/VISUAL.2004.34,http://dx.doi.org/10.1109/VISUAL.2004.34,91,98,1372184,,C,Most data used in the study of seafloor hydrothermal plumes consists of sonar (acoustic) scans and sensor readings. Visual data captures only a portion of the sonar data range due to the prohibitive cost and physical infeasibility of taking sufficient lighting and video equipment to such extreme depths. However,,,,,
