Conference,Year,Paper Title,Paper DOI,Link,First page,Last page,IEEE XPLORE Article Number,Panel,,,,,,,
VAST,2014,HydroQual: Visual Analysis of River Water Quality,10.1109/VAST.2014.7042488,http://dx.doi.org/10.1109/VAST.2014.7042488,123,132,7042488,,C,Economic development based on industrialization,,,,,
VAST,2014,Serendip: Topic Model-Driven Visual Exploration of Text Corpora,10.1109/VAST.2014.7042493,http://dx.doi.org/10.1109/VAST.2014.7042493,173,182,7042493,,C,Exploration and discovery in a large text corpus requires investigation at multiple levels of abstraction,,,,,
VAST,2014,Feedback-Driven Interactive Exploration of Large Multidimensional Data Supported by Visual Classifier,10.1109/VAST.2014.7042480,http://dx.doi.org/10.1109/VAST.2014.7042480,43,52,7042480,,C,The extraction of relevant and meaningful information from multivariate or high-dimensional data is a challenging problem. One reason for this is that the number of possible representations,,,,,
VAST,2014,Multi-Model Semantic Interaction for Text Analytics,10.1109/VAST.2014.7042492,http://dx.doi.org/10.1109/VAST.2014.7042492,163,172,7042492,,C,Semantic interaction offers an intuitive communication mechanism between human users and complex statistical models. By shielding the users from manipulating model parameters,,,,,
VAST,2014,A System for Visual Analysis of Radio Signal Data,10.1109/VAST.2014.7042479,http://dx.doi.org/10.1109/VAST.2014.7042479,33,42,7042479,,C,Analysis of radio transmissions is vital for military defense as it provides valuable information about enemy communication and infrastructure. One challenge to the data analysis task is that there are far too many signals for analysts to go through by hand. Even typical signal meta data (such as frequency band,,,,,
VAST,2014,Baseball4D: A Tool for Baseball Game Reconstruction & Visualization,10.1109/VAST.2014.7042478,http://dx.doi.org/10.1109/VAST.2014.7042478,23,32,7042478,,C,While many sports use statistics and video to analyze and improve game play,,,,,
VAST,2014,An Insightand Task-based Methodology for Evaluating Spatiotemporal Visual Analytics,10.1109/VAST.2014.7042482,http://dx.doi.org/10.1109/VAST.2014.7042482,63,72,7042482,,C,We present a method for evaluating visualizations using both tasks and exploration,,,,,
VAST,2014,Feature-Driven Visual Analytics of Soccer Data,10.1109/VAST.2014.7042477,http://dx.doi.org/10.1109/VAST.2014.7042477,13,22,7042477,,C,Soccer is one the most popular sports today and also very interesting from an scientific point of view. We present a system for analyzing high-frequency position-based soccer data at various levels of detail,,,,,
VAST,2014,Analyzing High-dimensional Multivariate Network Links with Integrated Anomaly Detection,,,,,,,,,,,,,
VAST,2014,Weaving a Carpet from Log Entries: A Network Security Visualization Built with Co-Creation,10.1109/VAST.2014.7042483,http://dx.doi.org/10.1109/VAST.2014.7042483,73,82,7042483,,C,"We created a pixel map for multivariate data based on an analysis of the needs of network security engineers. Parameters of a log record are shown as pixels and these pixels are stacked to represent a record. This allows a broad view of a data set on one screen while staying very close to the raw data and to expose common and rare patterns of user behavior through the visualization itself (the Carpet""). Visualizations that immediately point to areas of suspicious activity without requiring extensive filtering",,,,,
VAST,2014,Visual Analysis of Patterns in Multiple Amino Acid Mutation Graphs,10.1109/VAST.2014.7042485,http://dx.doi.org/10.1109/VAST.2014.7042485,93,102,7042485,,C,Proteins are essential parts in all living organisms. They consist of sequences of amino acids. An interaction with reactive agent can stimulate a mutation at a specific position in the sequence. This mutation may set off a chain reaction,,,,,
VAST,2014,TopicPanorama: a Full Picture of Relevant Topics,10.1109/VAST.2014.7042494,http://dx.doi.org/10.1109/VAST.2014.7042494,183,192,7042494,,C,We present a visual analytics approach to developing a full picture of relevant topics discussed in multiple sources such as news,,,,,
VAST,2014,Vismate: Interactive Visual Analysis of Station-Based Observatiion Data on Climate Changes,10.1109/VAST.2014.7042489,http://dx.doi.org/10.1109/VAST.2014.7042489,133,142,7042489,,C,We present a new approach to visualizing the climate data of multi-dimensional,,,,,
VAST,2014,Integrating Predictive Analytics and Social Media,10.1109/VAST.2014.7042495,http://dx.doi.org/10.1109/VAST.2014.7042495,193,202,7042495,,C,A key analytical task across many domains is model building and exploration for predictive analysis. Data is collected,,,,,
VAST,2014,An Integrated Visual Analysis System for Fusing MR Spectroscopy and Multi-Modal Radiology Imaging,10.1109/VAST.2014.7042481,http://dx.doi.org/10.1109/VAST.2014.7042481,53,62,7042481,,C,For cancers such as glioblastoma multiforme,,,,,
VAST,2014,YMCA - Your Mesh Comparison Application,10.1109/VAST.2014.7042491,http://dx.doi.org/10.1109/VAST.2014.7042491,153,162,7042491,,C,Polygonal meshes can be created in several different ways. In this paper we focus on the reconstruction of meshes from point clouds,,,,,
VAST,2014,A Visual Reasoning Approach for Data-driven Transport Assessment on Urban Roads,10.1109/VAST.2014.7042486,http://dx.doi.org/10.1109/VAST.2014.7042486,103,112,7042486,,C,Transport assessment plays a vital role in urban planning and traffic control,,,,,
VAST,2014,Using Visualizations to Monitor Changes and Harvest Insights from a Global-Scale Logging Infrastructure at Twitter,10.1109/VAST.2014.7042487,http://dx.doi.org/10.1109/VAST.2014.7042487,113,122,7042487,,C,Logging user activities is essential to data analysis for internet products and services. Twitter has built a unified logging infrastructure that captures user activities across all clients it owns,,,,,
VAST,2014,BoundarySeer: Visual Analysis of 2D Boundary Changes,10.1109/VAST.2014.7042490,http://dx.doi.org/10.1109/VAST.2014.7042490,143,152,7042490,,C,Boundary changes exist ubiquitously in our daily life. From the Antarctic ozone hole to the land desertification,,,,,
VAST,2014,Towards Interactive,,,,,,,,,,,,,
VAST,2014,PEARL: An Interactive Visual Analytic Tool for Understanding Personal Emotion Style Derived from Social Media,10.1109/VAST.2014.7042496,http://dx.doi.org/10.1109/VAST.2014.7042496,203,212,7042496,,C,Hundreds of millions of people leave digital footprints on social media (e.g.,,,,,
VAST,2014,Knowledge Generation Model for Visual Analytics,10.1109/TVCG.2014.2346481,http://dx.doi.org/10.1109/TVCG.2014.2346481,1604,1613,6875967,,T,Visual analytics enables us to analyze huge information spaces in order to support complex decision making and data exploration. Humans play a central role in generating knowledge from the snippets of evidence emerging from visual data analysis. Although prior research provides frameworks that generalize this process,,,,,
VAST,2014,INFUSE: Interactive Feature Selection for Predictive Modeling of High Dimensional Data,10.1109/TVCG.2014.2346482,http://dx.doi.org/10.1109/TVCG.2014.2346482,1614,1623,6876047,,T,Predictive modeling techniques are increasingly being used by data scientists to understand the probability of predicted outcomes. However,,,,,
VAST,2014,Transforming Scagnostics to Reveal Hidden Features,10.1109/TVCG.2014.2346572,http://dx.doi.org/10.1109/TVCG.2014.2346572,1624,1632,6875999,,T,Scagnostics (Scatterplot Diagnostics) were developed by Wilkinson et al. based on an idea of Paul and John Tukey,,,,,
VAST,2014,Supporting Communication and Coordination in Collaborative Sensemaking,10.1109/TVCG.2014.2346573,http://dx.doi.org/10.1109/TVCG.2014.2346573,1633,1642,6875986,,T,When people work together to analyze a data set,,,,,
VAST,2014,Opening the Black Box: Strategies for Increased User Involvement in Existing Algorithm Implementations,10.1109/TVCG.2014.2346578,http://dx.doi.org/10.1109/TVCG.2014.2346578,1643,1652,6875995,,T,An increasing number of interactive visualization tools stress the integration with computational software like MATLAB and R to access a variety of proven algorithms. In many cases,,,,,
VAST,2014,Progressive Visual Analytics: User-Driven Visual Exploration of In-Progress Analytics,10.1109/TVCG.2014.2346574,http://dx.doi.org/10.1109/TVCG.2014.2346574,1653,1662,6876049,,T,As datasets grow and analytic algorithms become more complex,,,,,
VAST,2014,Finding Waldo: Learning about Users from their Interactions,10.1109/TVCG.2014.2346575,http://dx.doi.org/10.1109/TVCG.2014.2346575,1663,1672,6875913,,T,Visual analytics is inherently a collaboration between human and computer. However,,,,,
VAST,2014,Interactive Visual Analysis of Image-Centric Cohort Study Data,10.1109/TVCG.2014.2346591,http://dx.doi.org/10.1109/TVCG.2014.2346591,1673,1682,6876009,,T,Epidemiological population studies impose information about a set of subjects (a cohort) to characterize disease-specific risk factors. Cohort studies comprise heterogenous variables describing the medical condition as well as demographic and lifestyle factors and,,,,,
VAST,2014,Visual Abstraction and Exploration of Multi-class Scatterplots,10.1109/TVCG.2014.2346594,http://dx.doi.org/10.1109/TVCG.2014.2346594,1683,1692,6875982,,T,Scatterplots are widely used to visualize scatter dataset for exploring outliers,,,,,
VAST,2014,Cupid: Cluster-Based Exploration of Geometry Generators with Parallel Coordinates and Radial Trees,10.1109/TVCG.2014.2346626,http://dx.doi.org/10.1109/TVCG.2014.2346626,1693,1702,6875958,,T,Geometry generators are commonly used in video games and evaluation systems for computer vision to create geometric shapes such as terrains,,,,,
VAST,2014,Visual Methods for Analyzing Probabilistic Classification Data,10.1109/TVCG.2014.2346660,http://dx.doi.org/10.1109/TVCG.2014.2346660,1703,1712,6875957,,T,Multi-class classifiers often compute scores for the classification samples describing probabilities to belong to different classes. In order to improve the performance of such classifiers,,,,,
VAST,2014,A Five-Level Design Framework for Bicluster Visualizations,10.1109/TVCG.2014.2346665,http://dx.doi.org/10.1109/TVCG.2014.2346665,1713,1722,6875974,,T,Analysts often need to explore and identify coordinated relationships (e.g.,,,,,
VAST,2014,VarifocalReader -- In-Depth Visual Analysis of Large Text Documents,10.1109/TVCG.2014.2346677,http://dx.doi.org/10.1109/TVCG.2014.2346677,1723,1732,6875959,,T,Interactive visualization provides valuable support for exploring,,,,,
VAST,2014,LoyalTracker: Visualizing Loyalty Dynamics in Search Engines,10.1109/TVCG.2014.2346912,http://dx.doi.org/10.1109/TVCG.2014.2346912,1733,1742,6876038,,T,The huge amount of user log data collected by search engine providers creates new opportunities to understand user loyalty and defection behavior at an unprecedented scale. However,,,,,
VAST,2014,VAET: A Visual Analytics Approach for E-Transactions Time-Series,10.1109/TVCG.2014.2346913,http://dx.doi.org/10.1109/TVCG.2014.2346913,1743,1752,6876015,,T,Previous studies on E-transaction time-series have mainly focused on finding temporal trends of transaction behavior. Interesting transactions that are time-stamped and situation-relevant may easily be obscured in a large amount of information. This paper proposes a visual analytics system,,,,,
VAST,2014,EvoRiver: Visual Analysis of Topic Coopetition on Social Media,10.1109/TVCG.2014.2346919,http://dx.doi.org/10.1109/TVCG.2014.2346919,1753,1762,6875992,,T,Cooperation and competition (jointly called ??oopetition?? are two modes of interactions among a set of concurrent topics on social media. How do topics cooperate or compete with each other to gain public attention? Which topics tend to cooperate or compete with one another? Who plays the key role in coopetition-related interactions? We answer these intricate questions by proposing a visual analytics system that facilitates the in-depth analysis of topic coopetition on social media. We model the complex interactions among topics as a combination of carry-over,,,,,
VAST,2014,OpinionFlow: Visual Analysis of Opinion Diffusion on Social Media,10.1109/TVCG.2014.2346920,http://dx.doi.org/10.1109/TVCG.2014.2346920,1763,1772,6876032,,T,It is important for many different applications such as government and business intelligence to analyze and explore the diffusion of public opinions on social media. However,,,,,
VAST,2014,#FluxFlow: Visual Analysis of Anomalous Information Spreading on Social Media,10.1109/TVCG.2014.2346922,http://dx.doi.org/10.1109/TVCG.2014.2346922,1773,1782,6876013,,T,We present FluxFlow,,,,,
VAST,2014,DecisionFlow: Visual Analytics for High-Dimensional Temporal Event Sequence Data,10.1109/TVCG.2014.2346682,http://dx.doi.org/10.1109/TVCG.2014.2346682,1783,1792,6875996,,T,Temporal event sequence data is increasingly commonplace,,,,,
VAST,2014,Footprints: A Visual Search Tool that Supports Discovery and Coverage Tracking,10.1109/TVCG.2014.2346743,http://dx.doi.org/10.1109/TVCG.2014.2346743,1793,1802,6875947,,T,Searching a large document collection to learn about a broad subject involves the iterative process of figuring out what to ask,,,,,
VAST,2014,Visual Analytics for Complex Engineering Systems: Hybrid Visual Steering of Simulation Ensembles,10.1109/TVCG.2014.2346744,http://dx.doi.org/10.1109/TVCG.2014.2346744,1803,1812,6876045,,T,In this paper we propose a novel approach to hybrid visual steering of simulation ensembles. A simulation ensemble is a collection of simulation runs of the same simulation model using different sets of control parameters. Complex engineering systems have very large parameter spaces so a nai??e sampling can result in prohibitively large simulation ensembles. Interactive steering of simulation ensembles provides the means to select relevant points in a multi-dimensional parameter space (design of experiment). Interactive steering efficiently reduces the number of simulation runs needed by coupling simulation and visualization and allowing a user to request new simulations on the fly. As system complexity grows,,,,,
VAST,2014,Visual Exploration of Sparse Traffic Trajectory Data,10.1109/TVCG.2014.2346746,http://dx.doi.org/10.1109/TVCG.2014.2346746,1813,1822,6876014,,T,In this paper,,,,,
VAST,2014,DIA2: Web-based Cyberinfrastructure for Visual Analysis of Funding Portfolios,10.1109/TVCG.2014.2346747,http://dx.doi.org/10.1109/TVCG.2014.2346747,1823,1832,6876046,,T,We present a design study of the Deep Insights Anywhere,,,,,
VAST,2014,Visualizing Mobility of Public Transportation System,10.1109/TVCG.2014.2346893,http://dx.doi.org/10.1109/TVCG.2014.2346893,1833,1842,6876029,,T,Public transportation systems (PTSs) play an important role in modern cities,,,,,
VAST,2014,Visual Analysis of Public Utility Service Problems in a Metropolis,10.1109/TVCG.2014.2346898,http://dx.doi.org/10.1109/TVCG.2014.2346898,1843,1852,6876008,,T,Issues about city utility services reported by citizens can provide unprecedented insights into the various aspects of such services. Analysis of these issues can improve living quality through evidence-based decision making. However,,,,,
VAST,2014,VASA: Interactive Computational Steering of Large Asynchronous Simulation Pipelines for Societal Infrastructure,10.1109/TVCG.2014.2346911,http://dx.doi.org/10.1109/TVCG.2014.2346911,1853,1862,6875926,,T,We present VASA,,,,,
VAST,2014,Proactive Spatiotemporal Resource Allocation and Predictive Visual Analytics for Community Policing and Law Enforcement,10.1109/TVCG.2014.2346926,http://dx.doi.org/10.1109/TVCG.2014.2346926,1863,1872,6875970,,T,In this paper,,,,,
VAST,2014,Run Watchers: Automatic Simulation-Based Decision Support in Flood Management,10.1109/TVCG.2014.2346930,http://dx.doi.org/10.1109/TVCG.2014.2346930,1873,1882,6875941,,T,In this paper,,,,,
VAST,2014,ConTour: Data-Driven Exploration of Multi-Relational Datasets for Drug Discovery,10.1109/TVCG.2014.2346752,http://dx.doi.org/10.1109/TVCG.2014.2346752,1883,1892,6875994,,T,Large scale data analysis is nowadays a crucial part of drug discovery. Biologists and chemists need to quickly explore and evaluate potentially effective yet safe compounds based on many datasets that are in relationship with each other. However,,,,,
VAST,2014,Visual Analytics for Comparison of Ocean Model Output with Reference Data: Detecting and Analyzing Geophysical Processes Using Clustering Ensembles,10.1109/TVCG.2014.2346751,http://dx.doi.org/10.1109/TVCG.2014.2346751,1893,1902,6876007,,T,Researchers assess the quality of an ocean model by comparing its output to that of a previous model version or to observations. One objective of the comparison is to detect and to analyze differences and similarities between both data sets regarding geophysical processes,,,,,
VAST,2014,Genotet: An Interactive Web-based Visual Exploration Framework to Support Validation of Gene Regulatory Networks,10.1109/TVCG.2014.2346753,http://dx.doi.org/10.1109/TVCG.2014.2346753,1903,1912,6876028,,T,Elucidation of transcriptional regulatory networks (TRNs) is a fundamental goal in biology,,,,,
VAST,2014,The Spinel Explorer - Interactive Visual Analysis of Spinel Group Minerals,10.1109/TVCG.2014.2346754,http://dx.doi.org/10.1109/TVCG.2014.2346754,1913,1922,6875977,,T,Geologists usually deal with rocks that are up to several thousand million years old. They try to reconstruct the tectonic settings where these rocks were formed and the history of events that affected them through the geological time. The spinel group minerals provide useful information regarding the geological environment in which the host rocks were formed. They constitute excellent indicators of geological environments (tectonic settings) and are of invaluable help in the search for mineral deposits of economic interest. The current workflow requires the scientists to work with different applications to analyze spine data. They do use specific diagrams,,,,,
VAST,2014,Visual Reconciliation of Alternative Similarity Spaces in Climate Modeling,10.1109/TVCG.2014.2346755,http://dx.doi.org/10.1109/TVCG.2014.2346755,1923,1932,6876041,,T,Visual data analysis often requires grouping of data objects based on their similarity. In many application domains researchers use algorithms and techniques like clustering and multidimensional scaling to extract groupings from data. While extracting these groups using a single similarity criteria is relatively straightforward,,,,,
InfoVis,2014,Learning Perceptual Kernels for Visualization Design,10.1109/TVCG.2014.2346978,http://dx.doi.org/10.1109/TVCG.2014.2346978,1933,1942,6875950,,T,Visualization design can benefit from careful consideration of perception,,,,,
InfoVis,2014,Ranking Visualizations of Correlation Using Weber's Law,10.1109/TVCG.2014.2346979,http://dx.doi.org/10.1109/TVCG.2014.2346979,1943,1952,6875978,,T,Despite years of research yielding systems and guidelines to aid visualization design,,,,,
InfoVis,2014,The relation between visualization size,,,,,,,,,,,,,
InfoVis,2014,A Principled Way of Assessing Visualization Literacy,10.1109/TVCG.2014.2346984,http://dx.doi.org/10.1109/TVCG.2014.2346984,1963,1972,6875906,,T,We describe a method for assessing the visualization literacy (VL) of a user. Assessing how well people understand visualizations has great value for research (e. g.,,,,,
InfoVis,2014,Reinforcing Visual Grouping Cues to Communicate Complex Informational Structure,10.1109/TVCG.2014.2346998,http://dx.doi.org/10.1109/TVCG.2014.2346998,1973,1982,6875960,,T,In his book Multimedia Learning [7],,,,,
InfoVis,2014,UpSet: Visualization of Intersecting Sets,10.1109/TVCG.2014.2346248,http://dx.doi.org/10.1109/TVCG.2014.2346248,1983,1992,6876017,,T,Understanding relationships between sets is an important analysis task that has received widespread attention in the visualization community. The major challenge in this context is the combinatorial explosion of the number of set intersections if the number of sets exceeds a trivial threshold. In this paper we introduce UpSet,,,,,
InfoVis,2014,OnSet: A Visualization Technique for Large-scale Binary Set Data,10.1109/TVCG.2014.2346249,http://dx.doi.org/10.1109/TVCG.2014.2346249,1993,2002,6876026,,T,Visualizing sets to reveal relationships between constituent elements is a complex representational problem. Recent research presents several automated placement and grouping techniques to highlight connections between set elements. However,,,,,
InfoVis,2014,DimpVis: Exploring Time-varying Information Visualizations by Direct Manipulation,10.1109/TVCG.2014.2346250,http://dx.doi.org/10.1109/TVCG.2014.2346250,2003,2012,6875985,,T,We introduce a new direct manipulation technique,,,,,
InfoVis,2014,Axis Calibration for Improving Data Attribute Estimation in Star Coordinates Plots,10.1109/TVCG.2014.2346258,http://dx.doi.org/10.1109/TVCG.2014.2346258,2013,2022,6875998,,T,Star coordinates is a well-known multivariate visualization method that produces linear dimensionality reduction mappings through a set of radial axes defined by vectors in an observable space. One of its main drawbacks concerns the difficulty to recover attributes of data samples accurately,,,,,
InfoVis,2014,Domino: Extracting,,,,,,,,,,,,,
InfoVis,2014,Attribute Signatures: Dynamic Visual Summaries for Analyzing Multivariate Geographical Data,10.1109/TVCG.2014.2346265,http://dx.doi.org/10.1109/TVCG.2014.2346265,2033,2042,6875987,,T,The visual analysis of geographically referenced datasets with a large number of attributes is challenging due to the fact that the characteristics of the attributes are highly dependent upon the locations at which they are focussed,,,,,
InfoVis,2014,Origin-Destination Flow Data Smoothing and Mapping,10.1109/TVCG.2014.2346271,http://dx.doi.org/10.1109/TVCG.2014.2346271,2043,2052,6875983,,T,This paper presents a new approach to flow mapping that extracts inherent patterns from massive geographic mobility data and constructs effective visual representations of the data for the understanding of complex flow trends. This approach involves a new method for origin-destination flow density estimation and a new method for flow map generalization,,,,,
InfoVis,2014,Stenomaps: Shorthand for shapes,10.1109/TVCG.2014.2346274,http://dx.doi.org/10.1109/TVCG.2014.2346274,2053,2062,6876003,,T,We address some of the challenges in representing spatial data with a novel form of geometric abstraction-the stenomap. The stenomap comprises a series of smoothly curving linear glyphs that each represent both the boundary and the area of a polygon. We present an efficient algorithm to automatically generate these open,,,,,
InfoVis,2014,Nmap: A Novel Neighborhood Preservation Space-filling Algorithm,10.1109/TVCG.2014.2346276,http://dx.doi.org/10.1109/TVCG.2014.2346276,2063,2071,6876012,,T,Space-filling techniques seek to use as much as possible the visual space to represent a dataset,,,,,
InfoVis,2014,Tree Colors: Color Schemes for Tree-Structured Data,10.1109/TVCG.2014.2346277,http://dx.doi.org/10.1109/TVCG.2014.2346277,2072,2081,6875961,,T,We present a method to map tree structures to colors from the Hue-Chroma-Luminance color model,,,,,
InfoVis,2014,Revisiting Bertin Matrices: New Interactions for Crafting Tabular Visualizations,10.1109/TVCG.2014.2346279,http://dx.doi.org/10.1109/TVCG.2014.2346279,2082,2091,6875988,,T,We present Bertifier,,,,,
InfoVis,2014,iVisDesigner: Expressive Interactive Design of Information Visualizations,10.1109/TVCG.2014.2346291,http://dx.doi.org/10.1109/TVCG.2014.2346291,2092,2101,6876042,,T,We present the design,,,,,
InfoVis,2014,Constructing Visual Representations: Investigating the Use of Tangible Tokens,10.1109/TVCG.2014.2346292,http://dx.doi.org/10.1109/TVCG.2014.2346292,2102,2111,6875946,,T,The accessibility of infovis authoring tools to a wide audience has been identified as a major research challenge. A key task in the authoring process is the development of visual mappings. While the infovis community has long been deeply interested in finding effective visual mappings,,,,,
InfoVis,2014,PanoramicData: Data Analysis through Pen & Touch,10.1109/TVCG.2014.2346293,http://dx.doi.org/10.1109/TVCG.2014.2346293,2112,2121,6876039,,T,Interactively exploring multidimensional datasets requires frequent switching among a range of distinct but inter-related tasks (e.g.,,,,,
InfoVis,2014,The Effects of Interactive Latency on Exploratory Visual Analysis,10.1109/TVCG.2014.2346452,http://dx.doi.org/10.1109/TVCG.2014.2346452,2122,2131,6876022,,T,To support effective exploration,,,,,
InfoVis,2014,Visualizing Statistical Mix Effects and Simpson's Paradox,10.1109/TVCG.2014.2346297,http://dx.doi.org/10.1109/TVCG.2014.2346297,2132,2141,6875927,,T,We discuss how ??ix effects??can surprise users of visualizations and potentially lead them to incorrect conclusions. This statistical issue (also known as ??mitted variable bias??or,,,,,
InfoVis,2014,Error Bars Considered Harmful: Exploring Alternate Encodings for Mean and Error,10.1109/TVCG.2014.2346298,http://dx.doi.org/10.1109/TVCG.2014.2346298,2142,2151,6875915,,T,When making an inference or comparison with uncertain,,,,,
InfoVis,2014,Four Experiments on the Perception of Bar Charts,10.1109/TVCG.2014.2346320,http://dx.doi.org/10.1109/TVCG.2014.2346320,2152,2160,6876021,,T,Bar charts are one of the most common visualization types. In a classic graphical perception paper,,,,,
InfoVis,2014,Visual Parameter Space Analysis: A Conceptual Framework,10.1109/TVCG.2014.2346321,http://dx.doi.org/10.1109/TVCG.2014.2346321,2161,2170,6876043,,T,Various case studies in different application domains have shown the great potential of visual parameter space analysis to support validating and using simulation models. In order to guide and systematize research endeavors in this area,,,,,
