VAST,2010,Flow-based scatterplots for sensitivity analysis,10.1109/VAST.2010.5652460,http://dx.doi.org/10.1109/VAST.2010.5652460,43,50,5652460,,C,Visualization of multi-dimensional data is challenging due to the number of complex correlations that may be present in the data but that are difficult to be visually identified. One of the main causes for this problem is the inherent loss of information that occurs when high-dimensional data is projected into 2D or 3D. Although 2D scatterplots are ubiquitous due to their simplicity and familiarity,,,,,
VAST,2010,Anomaly detection in GPS data based on visual analytics,10.1109/VAST.2010.5652467,http://dx.doi.org/10.1109/VAST.2010.5652467,51,58,5652467,,C,Modern machine learning techniques provide robust approaches for data-driven modeling and critical information extraction,,,,,
VAST,2010,Discovering bits of place histories from people's activity traces,10.1109/VAST.2010.5652478,http://dx.doi.org/10.1109/VAST.2010.5652478,59,66,5652478,,C,Events that happened in the past are important for understanding the ongoing processes,,,,,
VAST,2010,A visual analytics approach to model learning,10.1109/VAST.2010.5652484,http://dx.doi.org/10.1109/VAST.2010.5652484,67,74,5652484,,C,The process of learning models from raw data typically requires a substantial amount of user input during the model initialization phase. We present an assistive visualization system which greatly reduces the load on the users and makes the process of model initialization and refinement more efficient,,,,,
VAST,2010,Multidimensional data dissection using attribute relationship graphs,10.1109/VAST.2010.5652520,http://dx.doi.org/10.1109/VAST.2010.5652520,75,82,5652520,,C,Visual exploration and analysis is a process of discovering and dissecting the abundant and complex attribute relationships that pervade multidimensional data. Recent research has identified and characterized patterns of multiple coordinated views,,,,,
VAST,2010,Visual market sector analysis for financial time series data,10.1109/VAST.2010.5652530,http://dx.doi.org/10.1109/VAST.2010.5652530,83,90,5652530,,C,The massive amount of financial time series data that originates from the stock market generates large amounts of complex data of high interest. However,,,,,
VAST,2010,Two-stage framework for a topology-based projection and visualization of classified document collections,10.1109/VAST.2010.5652940,http://dx.doi.org/10.1109/VAST.2010.5652940,91,98,5652940,,C,During the last decades,,,,,
VAST,2010,Understanding text corpora with multiple facets,10.1109/VAST.2010.5652931,http://dx.doi.org/10.1109/VAST.2010.5652931,99,106,5652931,,C,Text visualization becomes an increasingly more important research topic as the need to understand massive-scale textual information is proven to be imperative for many people and businesses. However,,,,,
VAST,2010,VizCept: Supporting synchronous collaboration for constructing visualizations in intelligence analysis,10.1109/VAST.2010.5652932,http://dx.doi.org/10.1109/VAST.2010.5652932,107,114,5652932,,C,In this paper,,,,,
VAST,2010,Diamonds in the rough: Social media visual analytics for journalistic inquiry,10.1109/VAST.2010.5652922,http://dx.doi.org/10.1109/VAST.2010.5652922,115,122,5652922,,C,Journalists increasingly turn to social media sources such as Facebook or Twitter to support their coverage of various news events. For large-scale events such as televised debates and speeches,,,,,
VAST,2010,Visual readability analysis: How to make your writings easier to read,10.1109/VAST.2010.5652926,http://dx.doi.org/10.1109/VAST.2010.5652926,123,130,5652926,,C,We present a tool that is specifically designed to support a writer in revising a draft-version of a document. In addition to showing which paragraphs and sentences are difficult to read and understand,,,,,
VAST,2010,NetClinic: Interactive visualization to enhance automated fault diagnosis in enterprise networks,10.1109/VAST.2010.5652910,http://dx.doi.org/10.1109/VAST.2010.5652910,131,138,5652910,,C,Diagnosing faults in an operational computer network is a frustrating,,,,,
VAST,2010,Geo-historical context support for information foraging and sensemaking: Conceptual model,,,,,,,,,,,,,
VAST,2010,Real-time aggregation of Wikipedia data for visual analytics,10.1109/VAST.2010.5652896,http://dx.doi.org/10.1109/VAST.2010.5652896,147,154,5652896,,C,Wikipedia has been built to gather encyclopedic knowledge using a collaborative social process that has proved its effectiveness. However,,,,,
VAST,2010,Click2Annotate: Automated Insight Externalization with rich semantics,10.1109/VAST.2010.5652885,http://dx.doi.org/10.1109/VAST.2010.5652885,155,162,5652885,,C,Insight Externalization (IE) refers to the process of capturing and recording the semantics of insights in decision making and problem solving. To reduce human effort,,,,,
VAST,2010,Interactive querying of temporal data using a comic strip metaphor,10.1109/VAST.2010.5652890,http://dx.doi.org/10.1109/VAST.2010.5652890,163,170,5652890,,C,Finding patterns in temporal data is an important data analysis task in many domains. Static visualizations can help users easily see certain instances of patterns,,,,,
VAST,2010,A closer look at note taking in the co-located collaborative visual analytics process,10.1109/VAST.2010.5652879,http://dx.doi.org/10.1109/VAST.2010.5652879,171,178,5652879,,C,This paper highlights the important role that record-keeping (i.e. taking notes and saving charts) plays in collaborative data analysis within the business domain. The discussion of record-keeping is based on observations from a user study in which co-located teams worked on collaborative visual analytics tasks using large interactive wall and tabletop displays. Part of our findings is a collaborative data analysis framework that encompasses note taking as one of the main activities. We observed that record-keeping was a critical activity within the analysis process. Based on our observations,,,,,
VAST,2010,An exploratory study of co-located collaborative visual analytics around a tabletop display,10.1109/VAST.2010.5652880,http://dx.doi.org/10.1109/VAST.2010.5652880,179,186,5652880,,C,Co-located collaboration can be extremely valuable during complex visual analytics tasks. This paper presents an exploratory study of a system designed to support collaborative visual analysis tasks on a digital tabletop display. Fifteen participant pairs employed Cam-biera,,,,,
VAST,2010,Helping users recall their reasoning process,10.1109/VAST.2010.5653598,http://dx.doi.org/10.1109/VAST.2010.5653598,187,194,5653598,,C,The final product of an analyst's investigation using a visualization is often a report of the discovered knowledge,,,,,
VAST,2010,Comparing different levels of interaction constraints for deriving visual problem isomorphs,10.1109/VAST.2010.5653599,http://dx.doi.org/10.1109/VAST.2010.5653599,195,202,5653599,,C,Interaction and manual manipulation have been shown in the cognitive science literature to play a critical role in problem solving. Given different types of interactions or constraints on interactions,,,,,
VAST,2010,Towards the Personal Equation of Interaction: The impact of personality factors on visual analytics interface interaction,10.1109/VAST.2010.5653587,http://dx.doi.org/10.1109/VAST.2010.5653587,203,210,5653587,,C,These current studies explored the impact of individual differences in personality factors on interface interaction and learning performance behaviors in both an interactive visualization and a menu-driven web table in two studies. Participants were administered 3 psychometric measures designed to assess Locus of Control,,,,,
VAST,2010,Poster: Dynamic time transformation for interpreting clusters of trajectories with space-time cube,10.1109/VAST.2010.5653580,http://dx.doi.org/10.1109/VAST.2010.5653580,213,214,5653580,X,M,We propose a set of techniques that support visual interpretation of trajectory clusters by transforming absolute time references into relative positions within temporal cycles or with respect to the starting and/or ending times of the trajectories. We demonstrate the work of the approach on a real data set about individual movement over one year.,Andrienko,,,,
VAST,2010,Interactive visual analysis of multiobjective optimizations,10.1109/VAST.2010.5651694,http://dx.doi.org/10.1109/VAST.2010.5651694,215,216,5651694,X,M,Optimization problems are typically addressed by purely automatic approaches. For multi-objective problems,,,,,
VAST,2010,Cluster correspondence views for enhanced analysis of SOM displays,10.1109/VAST.2010.5651676,http://dx.doi.org/10.1109/VAST.2010.5651676,217,218,5651676,X,M,The Self-Organizing Map (SOM) algorithm is a popular and widely used cluster algorithm. Its constraint to organize clusters on a grid structure makes it very amenable to visualization. On the other hand,,,,,
VAST,2010,Visualization of temporal relationships within coordinated views,10.1109/VAST.2010.5651617,http://dx.doi.org/10.1109/VAST.2010.5651617,219,220,5651617,X,M,In command and control (C2) environments,,,,,
VAST,2010,Conveying network features in geospatial battlespace displays,10.1109/VAST.2010.5651192,http://dx.doi.org/10.1109/VAST.2010.5651192,221,222,5651192,X,M,Advanced battlespace network visualization techniques are required within the modern Air Operations Center (AOC) to improve cross-domain situation awareness and to support planning and decision-making. We present a visualization toolkit to address this need that supports the integration of network health and status information and meta-information with other traditional AOC information resources and activities across air,,,,,
VAST,2010,ALIDA: Using machine learning for intent discernment in visual analytics interfaces,10.1109/VAST.2010.5650854,http://dx.doi.org/10.1109/VAST.2010.5650854,223,224,5650854,X,M,In this paper,,,,,
VAST,2010,Enhancing text-based chat with visuals for hazardous weather decision making,10.1109/VAST.2010.5650815,http://dx.doi.org/10.1109/VAST.2010.5650815,225,226,5650815,X,M,We created a visual chat application for use during hazardous weather events. The application,,,,,
VAST,2010,Visual analysis of frequent patterns in large time series,10.1109/VAST.2010.5650766,http://dx.doi.org/10.1109/VAST.2010.5650766,227,228,5650766,X,M,The detection of previously unknown,,,,,
VAST,2010,Visually representing geo-temporal differences,10.1109/VAST.2010.5652951,http://dx.doi.org/10.1109/VAST.2010.5652951,229,230,5652951,X,M,Data sets that contain geospatial and temporal elements can be challenging to analyze. In particular,,,,,
VAST,2010,A continuous analysis process between desktop and collaborative visual analytics environments,10.1109/VAST.2010.5652958,http://dx.doi.org/10.1109/VAST.2010.5652958,231,232,5652958,X,M,Since its inception,,,,,
VAST,2010,EmailTime: Visual analytics of emails,10.1109/VAST.2010.5652968,http://dx.doi.org/10.1109/VAST.2010.5652968,233,234,5652968,X,M,Although the discovery and analysis of communication patterns in large and complex email datasets are difficult tasks,,,,,
VAST,2010,Enron case study: Analysis of email behavior using EmailTime,10.1109/VAST.2010.5649905,http://dx.doi.org/10.1109/VAST.2010.5649905,235,236,5649905,X,M,This paper presents a case study with Enron email dataset to explore the behaviors of email users within different organizational positions. We defined email behavior as the email activity level of people regarding a series of measured metrics e.g. sent and received emails,,,,,
VAST,2010,Large-scale neuroanatomical visualization using a manifold embedding approach,10.1109/VAST.2010.5652532,http://dx.doi.org/10.1109/VAST.2010.5652532,237,238,5652532,X,M,We present a unified framework for data processing,,,,,
VAST,2010,Combining statistical independence testing,,,,,,,,,,,,,
VAST,2010,Visual tools for dynamic analysis of complex situations,10.1109/VAST.2010.5654451,http://dx.doi.org/10.1109/VAST.2010.5654451,241,242,5654451,X,M,This paper presents an interactive interface synchronized with a simulation framework for exploring complex scenarios. This interface exploits visual analysis for facilitating the understanding of complex situation by human users.,Mokhtari,,,,
VAST,2010,Data representation and exploration with Geometric Wavelets,10.1109/VAST.2010.5653822,http://dx.doi.org/10.1109/VAST.2010.5653822,243,244,5653822,X,M,Geometric Wavelets is a new multi-scale data representation technique which is useful for a variety of applications such as data compression,,,,,
VAST,2010,Poster: Translating cross-filtered queries into questions,10.1109/VAST.2010.5650251,http://dx.doi.org/10.1109/VAST.2010.5650251,245,246,5650251,X,M,Complex combinations of coordinated multiple views are increasingly used to design tools for highly interactive visual exploration and analysis of multidimensional data. While complex coordination patterns provide substantial utility through expressive querying,,,,,
VAST,2010,ProDV &#x2014; A case study in delivering visual analytics,10.1109/VAST.2010.5650219,http://dx.doi.org/10.1109/VAST.2010.5650219,247,248,5650219,X,M,We present a custom visual analytics system developed in conjunction with the test and evaluation community of the US Army. We designed and implemented a visual programming environment for configuring a variety of interactive visual analysis capabilities. Our abstraction of the visualization process is based on insights gained from interviews conducted with expert users. We show that this model allowed analysts to implement multiple visual analysis capabilities for network performance,,,,,
VAST,2010,A Visual Analytics approach to identifying protein structural constraints,10.1109/VAST.2010.5650199,http://dx.doi.org/10.1109/VAST.2010.5650199,249,250,5650199,X,M,Predicting protein structures has long been a grand-challenge problem. Fine-grained computational simulation of folding events from a protein's synthesis to its final stable structure remains computationally intractable. Therefore,,,,,
VAST,2010,A radial visualization tool for depicting hierarchically structured video content,10.1109/VAST.2010.5650177,http://dx.doi.org/10.1109/VAST.2010.5650177,251,252,5650177,X,M,The visual analysis of video content is an important research topic due to the huge amount of video data that is generated every day. Annotating this data will become a major problem since the amount of videos further increases. With this work we introduce a system that combines a visualization tool with automatic video segmentation techniques and a characteristic key-frame extraction. A summary of the content of a whole video in one view is realized. Furthermore,,,,,
VAST,2010,Adapting Daniel and Wood's modeling approach to interactive visual analytics,10.1109/VAST.2010.5649831,http://dx.doi.org/10.1109/VAST.2010.5649831,253,254,5649831,X,M,This poster describes our progress in developing an interactive linear modeling system that supports the modeling approach described by Daniel and Wood. Our visual interface permits analysts to build sets of possible models and then creates appropriate visualizations to permit human-in-the-loop model comparison and selection.,Talbot,,,,
InfoVis,2009,"""Search",,,,,,,,,,,,,
InfoVis,2009,A Comparison of User-Generated and Automatic Graph Layouts,10.1109/TVCG.2009.109,http://dx.doi.org/10.1109/TVCG.2009.109,961,968,5290700,,T,The research presented in this paper compares user-generated and automatic graph layouts. Following the methods suggested by van Ham et al. (2008),,,,,
InfoVis,2009,A Multi-Threading Architecture to Support Interactive Visual Exploration,10.1109/TVCG.2009.110,http://dx.doi.org/10.1109/TVCG.2009.110,1113,1120,5290719,,T,During continuous user interaction,,,,,
InfoVis,2009,A Nested Model for Visualization Design and Validation,10.1109/TVCG.2009.111,http://dx.doi.org/10.1109/TVCG.2009.111,921,928,5290695,,T,We present a nested model for the visualization design and validation with four layers: characterize the task and data in the vocabulary of the problem domain,,,,,
InfoVis,2009,ABySS-Explorer: Visualizing Genome Sequence Assemblies,10.1109/TVCG.2009.116,http://dx.doi.org/10.1109/TVCG.2009.116,881,888,5290690,,T,One bottleneck in large-scale genome sequencing projects is reconstructing the full genome sequence from the short subsequences produced by current technologies. The final stages of the genome assembly process inevitably require manual inspection of data inconsistencies and could be greatly aided by visualization. This paper presents our design decisions in translating key data features identified through discussions with analysts into a concise visual encoding. Current visualization tools in this domain focus on local sequence errors making high-level inspection of the assembly difficult if not impossible. We present a novel interactive graph display,,,,,
InfoVis,2009,ActiviTree: Interactive Visual Exploration of Sequences in Event-Based Data Using Graph Similarity,10.1109/TVCG.2009.117,http://dx.doi.org/10.1109/TVCG.2009.117,945,952,5290698,,T,The identification of significant sequences in large and complex event-based temporal data is a challenging problem with applications in many areas of today's information intensive society. Pure visual representations can be used for the analysis,,,,,
InfoVis,2009,Bubble Sets: Revealing Set Relations with Isocontours over Existing Visualizations,10.1109/TVCG.2009.122,http://dx.doi.org/10.1109/TVCG.2009.122,1009,1016,5290706,,T,While many data sets contain multiple relationships,,,,,
InfoVis,2009,code_swarm: A Design Study in Organic Software Visualization,10.1109/TVCG.2009.123,http://dx.doi.org/10.1109/TVCG.2009.123,1097,1104,5290717,,T,In May of 2008,,,,,
InfoVis,2009,Comparing Dot and Landscape Spatializations for Visual Memory Differences,10.1109/TVCG.2009.127,http://dx.doi.org/10.1109/TVCG.2009.127,1033,1040,5290709,,T,Spatialization displays use a geographic metaphor to arrange non-spatial data. For example,,,,,
InfoVis,2009,Configuring Hierarchical Layouts to Address Research Questions,10.1109/TVCG.2009.128,http://dx.doi.org/10.1109/TVCG.2009.128,977,984,5290702,,T,We explore the effects of selecting alternative layouts in hierarchical displays that show multiple aspects of large multivariate datasets,,,,,
InfoVis,2009,Conjunctive Visual Forms,10.1109/TVCG.2009.129,http://dx.doi.org/10.1109/TVCG.2009.129,929,936,5290696,,T,Visual exploration of multidimensional data is a process of isolating and extracting relationships within and between dimensions. Coordinated multiple view approaches are particularly effective for visual exploration because they support precise expression of heterogeneous multidimensional queries using simple interactions. Recent visual analytics research has made significant progress in identifying and understanding patterns of composed views and coordinations that support fast,,,,,
InfoVis,2009,Constructing Overview + Detail Dendrogram-Matrix Views,10.1109/TVCG.2009.130,http://dx.doi.org/10.1109/TVCG.2009.130,889,896,5290691,,T,A dendrogram that visualizes a clustering hierarchy is often integrated with a re-orderable matrix for pattern identification. The method is widely used in many research fields including biology,,,,,
InfoVis,2009,Document Cards: A Top Trumps Visualization for Documents,10.1109/TVCG.2009.139,http://dx.doi.org/10.1109/TVCG.2009.139,1145,1152,5290723,,T,Finding suitable,,,,,
InfoVis,2009,Exemplar-based Visualization of Large Document Corpus,10.1109/TVCG.2009.140,http://dx.doi.org/10.1109/TVCG.2009.140,1161,1168,5290725,,T,With the rapid growth of the World Wide Web and electronic information services,,,,,
InfoVis,2009,Flow Mapping and Multivariate Visualization of Large Spatial Interaction Data,10.1109/TVCG.2009.143,http://dx.doi.org/10.1109/TVCG.2009.143,1041,1048,5290710,,T,Spatial interactions (or flows),,,,,
InfoVis,2009,FromDaDy: Spreading Aircraft Trajectories Across Views to Support Iterative Queries,10.1109/TVCG.2009.145,http://dx.doi.org/10.1109/TVCG.2009.145,1017,1024,5290707,,T,When displaying thousands of aircraft trajectories on a screen,,,,,
InfoVis,2009,GeneShelf: A Web-based Visual Interface for Large Gene Expression Time-Series Data Repositories,10.1109/TVCG.2009.146,http://dx.doi.org/10.1109/TVCG.2009.146,905,912,5290693,,T,A widespread use of high-throughput gene expression analysis techniques enabled the biomedical research community to share a huge body of gene expression datasets in many public databases on the web. However,,,,,
InfoVis,2009,Harnessing the Information Ecosystem with Wiki-based Visualization Dashboards,10.1109/TVCG.2009.148,http://dx.doi.org/10.1109/TVCG.2009.148,1081,1088,5290715,,T,We describe the design and deployment of Dashiki,,,,,
InfoVis,2009,Interaction Techniques for Selecting and Manipulating Subgraphs in Network Visualizations,10.1109/TVCG.2009.151,http://dx.doi.org/10.1109/TVCG.2009.151,937,944,5290697,,T,We present a novel and extensible set of interaction techniques for manipulating visualizations of networks by selecting subgraphs and then applying various commands to modify their layout or graphical properties. Our techniques integrate traditional rectangle and lasso selection,,,,,
InfoVis,2009,Interactive Dimensionality Reduction Through User-defined Combinations of Quality Metrics,10.1109/TVCG.2009.153,http://dx.doi.org/10.1109/TVCG.2009.153,993,1000,5290704,,T,Multivariate data sets including hundreds of variables are increasingly common in many application areas. Most multivariate visualization techniques are unable to display such data effectively,,,,,
InfoVis,2009,Lark: Coordinating Co-located Collaboration with Information Visualization,10.1109/TVCG.2009.162,http://dx.doi.org/10.1109/TVCG.2009.162,1065,1072,5290713,,T,Large multi-touch displays are expanding the possibilities of multiple-coordinated views by allowing multiple people to interact with data in concert or independently. We present Lark,,,,,
InfoVis,2009,Mapping Text with Phrase Nets,10.1109/TVCG.2009.165,http://dx.doi.org/10.1109/TVCG.2009.165,1169,1176,5290726,,T,We present a new technique,,,,,
InfoVis,2009,MizBee: A Multiscale Synteny Browser,10.1109/TVCG.2009.167,http://dx.doi.org/10.1109/TVCG.2009.167,897,904,5290692,,T,In the field of comparative genomics,,,,,
InfoVis,2009,Participatory Visualization with Wordle,10.1109/TVCG.2009.171,http://dx.doi.org/10.1109/TVCG.2009.171,1137,1144,5290722,,T,We discuss the design and usage of ldquoWordle,,,,,
InfoVis,2009,Protovis: A Graphical Toolkit for Visualization,10.1109/TVCG.2009.174,http://dx.doi.org/10.1109/TVCG.2009.174,1121,1128,5290720,,T,Despite myriad tools for visualizing data,,,,,
InfoVis,2009,ResultMaps: Visualization for Search Interfaces,10.1109/TVCG.2009.176,http://dx.doi.org/10.1109/TVCG.2009.176,1057,1064,5290712,,T,Hierarchical representations are common in digital repositories,,,,,
InfoVis,2009,Scattering Points in Parallel Coordinates,10.1109/TVCG.2009.179,http://dx.doi.org/10.1109/TVCG.2009.179,1001,1008,5290705,,T,In this paper,,,,,
InfoVis,2009,SellTrend: Inter-Attribute Visual Analysis of Temporal Transaction Data,10.1109/TVCG.2009.180,http://dx.doi.org/10.1109/TVCG.2009.180,1025,1032,5290708,,T,We present a case study of our experience designing SellTrend,,,,,
InfoVis,2009,Smooth Graphs for Visual Exploration of Higher-Order State Transitions,10.1109/TVCG.2009.181,http://dx.doi.org/10.1109/TVCG.2009.181,969,976,5290701,,T,In this paper,,,,,
InfoVis,2009,Spatiotemporal Analysis of Sensor Logs using Growth Ring Maps,10.1109/TVCG.2009.182,http://dx.doi.org/10.1109/TVCG.2009.182,913,920,5290694,,T,Spatiotemporal analysis of sensor logs is a challenging research field due to three facts: a) traditional two-dimensional maps do not support multiple events to occur at the same spatial location,,,,,
InfoVis,2009,SpicyNodes: Radial Layout Authoring for the General Public,10.1109/TVCG.2009.183,http://dx.doi.org/10.1109/TVCG.2009.183,1089,1096,5290716,,T,Trees and graphs are relevant to many online tasks such as visualizing social networks,,,,,
InfoVis,2009,Temporal Summaries: Supporting Temporal Categorical Searching,,,,,,,,,,,,,
InfoVis,2009,The Benefits of Synchronous Collaborative Information Visualization: Evidence from an Experimental Evaluation,10.1109/TVCG.2009.188,http://dx.doi.org/10.1109/TVCG.2009.188,1073,1080,5290714,,T,A great corpus of studies reports empirical evidence of how information visualization supports comprehension and analysis of data. The benefits of visualization for synchronous group knowledge work,,,,,
InfoVis,2009,Towards Utilizing GPUs in Information Visualization: A Model and Implementation of Image-Space Operations,10.1109/TVCG.2009.191,http://dx.doi.org/10.1109/TVCG.2009.191,1105,1112,5290718,,T,Modern programmable GPUs represent a vast potential in terms of performance and visual flexibility for information visualization research,,,,,
InfoVis,2009,Visual Analysis of Inter-Process Communication for Large-Scale Parallel Computing,10.1109/TVCG.2009.196,http://dx.doi.org/10.1109/TVCG.2009.196,1129,1136,5290721,,T,In serial computation,,,,,
InfoVis,2009,Visualizing Social Photos on a Hasse Diagram for Eliciting Relations and Indexing New Photos,10.1109/TVCG.2009.201,http://dx.doi.org/10.1109/TVCG.2009.201,985,992,5290703,,T,Social photos,,,,,
InfoVis,2009,Visualizing the Intellectual Structure with Paper-Reference Matrices,10.1109/TVCG.2009.202,http://dx.doi.org/10.1109/TVCG.2009.202,1153,1160,5290724,,T,Visualizing the intellectual structure of scientific domains using co-cited units such as references or authors has become a routine for domain analysis. In previous studies,,,,,
SciVis,2009,A Novel Interface for Interactive Exploration of DTI fibers,10.1109/TVCG.2009.112,http://dx.doi.org/10.1109/TVCG.2009.112,1433,1440,5290758,,T,Visual exploration is essential to the visualization and analysis of densely sampled 3D DTI fibers in biological speciments,,,,,
